INPUT:id	INPUT:title	INPUT:text	INPUT:name	INPUT:url
1	Преступление и наказание	Глава 1 В начале июля, в чрезвычайно жаркое время, под вечер, один молодой человек вышел из своей каморки, которую нанимал от жильцов в С — м переулке, на улицу и медленно, как бы в нерешимости, отправился к К — ну мосту. Он благополучно избегнул встречи с своею хозяйкой на лестнице. Каморка его приходилась под самою кровлей высокого пятиэтажного дома и походила более на шкаф, чем на квартиру. Квартирная же хозяйка его, у которой он нанимал эту каморку с обедом и прислугой, помещалась одною лестницей ниже, в отдельной квартире, и каждый раз, при выходе на улицу, ему непременно надо было проходить мимо хозяйкиной кухни, почти всегда настежь отворенной на лестницу. И каждый раз молодой человек, проходя мимо, чувствовал какое-то болезненное и трусливое ощущение, которого стыдился и от которого морщился. Он был должен кругом хозяйке и боялся с нею встретиться.	Госпожа Зарницына, хозяйка квартиры	https://ilibrary.ru/text/69/p.1/index.html
4	Мастер и Маргарита	Речь эта, как впоследствии узнали, шла об Иисусе Христе. Дело в том, что редактор заказал поэту для очередной книжки журнала большую антирелигиозную поэму. Эту поэму Иван Николаевич сочинил, и в очень короткий срок, но, к сожалению, ею редактора нисколько не удовлетворил. Очертил Бездомный главное действующее лицо своей поэмы, то есть Иисуса, очень черными красками, и тем не менее всю поэму приходилось, по мнению редактора, писать заново. И вот теперь редактор читал поэту нечто вроде лекции об Иисусе, с тем чтобы подчеркнуть основную ошибку поэта. Трудно сказать, что именно подвело Ивана Николаевича – изобразительная ли сила его таланта или полное незнакомство с вопросом, по которому он собирался писать, – но Иисус в его изображении получился ну совершенно как живой, хотя и не привлекающий к себе персонаж. Берлиоз же хотел доказать поэту, что главное не в том, каков был Иисус, плох ли, хорош ли, а в том, что Иисуса-то этого, как личности, вовсе не существовало на свете и что все рассказы о нем – простые выдумки, самый обыкновенный миф. Надо заметить, что редактор был человеком начитанным и очень умело указывал в своей речи на древних историков, например, на знаменитого Филона Александрийского, на блестяще образованного Иосифа Флавия, никогда ни словом не упоминавших о существовании Иисуса. Обнаруживая солидную эрудицию, Михаил Александрович сообщил поэту, между прочим, и о том, что то место в 15-й книге, в главе 44-й знаменитых Тацитовых «Анналов», где говорится о казни Иисуса, – есть не что иное, как позднейшая поддельная вставка.	поэт Иван Николаевич Понырев (Бездомный)	https://masterimargo.ru/book-1.html
1	Отца и дети	Глава 1 — Что, Петр, не видать еще? — спрашивал 20-го мая 1859 года, выходя без шапки на низкое крылечко постоялого двора на *** шоссе, барин лет сорока с небольшим, в запыленном пальто и клетчатых панталонах, у своего слуги, молодого и щекастого малого с беловатым пухом на подбородке и маленькими тусклыми глазенками. Слуга, в котором все: и бирюзовая сережка в ухе, и напомаженные разноцветные волосы, и учтивые телодвижения, словом, все изобличало человека новейшего, усовершенствованного поколения, посмотрел снисходительно вдоль дороги и ответствовал: «Никак нет-с, не видать». — Не видать? — повторил барин. — Не видать, — вторично ответствовал слуга. Барин вздохнул и присел на скамеечку. Познакомим с ним читателя, пока он сидит, подогнувши под себя ножки и задумчиво поглядывая кругом.	Николай Петрович Кирсанов	https://ilibrary.ru/text/96/p.1/index.html
8	Война и мир	- Вы никогда не думали о том, чтобы женить вашего блудного сына Анатоля? Говорят, - сказала она, - что старые девицы имеют манию женить. Я еще не чувствую за собою этой слабости, но у меня есть одна маленькая особа , которая очень несчастлива с отцом, наша родственница, княжна Болконская. - Князь Василий не отвечал, хотя с свойственною светским людям быстротой соображения и памяти показал движением головы, что он принял к соображению эти сведения. - Нет, вы знаете ли, что этот Анатоль мне стоит 40.000 в год, - сказал он, видимо, не в силах удерживать печальный ход своих мыслей. Он помолчал. - Что будет через пять лет, если это пойдет так? Вот выгода быть отцом. Она богата, ваша княжна? - Отец очень богат и скуп. Он живет в деревне. Знаете, этот известный князь Болконский, отставленный еще при покойном императоре и прозванный прусским королем. Он очень умный человек, но со странностями и тяжелый. Бедняжка несчастлива, как камни. У нее брат, вот что недавно женился на Lise Мейнен, адъютант Кутузова. Он будет нынче у меня. - Послушайте, милая Аннет, - сказал князь, взяв вдруг свою собеседницу за руку и пригибая ее почему-то книзу. - Устройте мне это дело, и я навсегда ваш вернейший раб как пишет мне мой староста донесенья: покой-ер-п!. Она хорошей фамилии и богата. Всё, что мне нужно.	княжна Мария Болконская, дочь князя Николая Болконского	https://ru.wikisource.org/wiki/Война_и_мир_(Толстой)/Том_I/Часть_I/Глава_I
9	Анна Каренина	— Ничего, сударь образуется, — сказал Матвей. — Образуется? — Так точно-с. — Ты думаешь? Это кто там? — спросил Степан Аркадьич, услыхав за дверью шум женского платья. — Это я-с, — сказал твердый и приятный женский голос, и из-за двери высунулось строгое рябое лицо Матрены Филимоновны, нянюшки. — Ну что, Матреша? — спросил Степан Аркадьич, выходя к ней в дверь. Несмотря на то, что Степан Аркадьич был кругом виноват перед женой и сам чувствовал это, почти все в доме, даже нянюшка, главный друг Дарьи Александровны, были на его стороне. — Ну что? — сказал он уныло. — Вы сходите, сударь, повинитесь еще. Авось Бог даст. Очень мучаются, и смотреть жалости, да и все в доме навынтараты пошло. Детей, сударь, пожалеть надо. Повинитесь, сударь. Что делать! Люби кататься... — Да ведь не примет... — А вы свое сделайте. Бог милостив, Богу молитесь, сударь, Богу молитесь. — Ну, хорошо, ступай, — сказал Степан Аркадьич, вдруг покраснев. — Ну, так давай одеваться, — обратился он к Матвею и решительно скинул халат. Матвей уже держал, сдувая что-то невидимое, хомутом приготовленную рубашку и с очевидным удовольствием облек в нее холеное тело барина.	Матрёна Филимоновна, няня в доме Облонских	https://ilibrary.ru/text/1099/p.2/index.html
6	12 стульев	Оказывается, что не вносили. Калоши тоже не были помыты. Ипполит Матвеевич не любил свою тещу. Клавдия Ивановна была глупа, и ее преклонный возраст не позволял надеяться на то, что она когда-нибудь поумнеет. Скупа она была до чрезвычайности, и только бедность Ипполита Матвеевича не давала развернуться этому захватывающему чувству. Голос у нее был такой силы и густоты, что ему позавидовал бы Ричард Львиное Сердце.[*] И, кроме того, что было самым ужасным, Клавдия Ивановна видела сны. Она видела их всегда. Ей снились девушки в кушаках и без них, лошади, обшитые желтым драгунским кантом,[*] дворники, играющие на арфах, архангелы в сторожевых тулупах, прогуливающиеся по ночам с колотушками в руках, и вязальные спицы, которые сами собой прыгали по комнате, производя огорчительный звон. Пустая старуха была Клавдия Ивановна. Вдобавок ко всему под носом у нее росли усы, и каждый ус был похож на кисточку для бритья. Ипполит Матвеевич, слегка раздраженный, вышел из дому. У входа в свое потасканное заведение стоял, прислонясь к дверному косяку и скрестив руки, гробовых дел мастер Безенчук. От систематических крахов своих коммерческих начинаний и от долговременного употребления внутрь горячительных напитков глаза мастера были ярко желтыми, как у кота, и горели неугасимым огнем.	Ипполит Матвеевич Воробьянинов	https://онлайн-читать.рф/ильф-и-петров-12-стульев/#I
4	Герой нашего времени	Наконец вот и колодец... На площадке близ него построен домик с красной кровлею над ванной, а подальше галерея, где гуляют во время дождя. Несколько раненых офицеров сидели на лавке, подобрав костыли, — бледные, грустные. Несколько дам скорыми шагами ходили взад и вперед по площадке, ожидая действия вод. Между ними были два-три хорошеньких личика. Под виноградными аллеями, покрывающими скат Машука, мелькали порою пестрые шляпки любительниц уединения вдвоем, потому что всегда возле такой шляпки я замечал или военную фуражку или безобразную круглую шляпу. На крутой скале, где построен павильон, называемый Эоловой Арфой, торчали любители видов и наводили телескоп на Эльборус; между ними было два гувернера с своими воспитанниками, приехавшими лечиться от золотухи. Я остановился, запыхавшись, на краю горы и, прислонясь к углу домика, стал рассматривать окрестность, как вдруг слышу за собой знакомый голос: — Печорин! давно ли здесь?	Григорий Печорин	https://ilibrary.ru/text/12/p.6/index.html
6	Отца и дети	Глава 2 — Дай же отряхнуться, папаша, — говорил несколько сиплым от дороги, но звонким юношеским голосом Аркадий, весело отвечая на отцовские ласки, — я тебя всего запачкаю. — Ничего, ничего, — твердил, умиленно улыбаясь, Николай Петрович и раза два ударил рукою по воротнику сыновней шинели и по собственному пальто. — Покажи-ка себя, покажи-ка, — прибавил он, отодвигаясь, и тотчас же пошел торопливыми шагами к постоялому двору, приговаривая: «Вот сюда, сюда, да лошадей поскорее». Николай Петрович казался гораздо встревоженнее своего сына; он словно потерялся немного, словно робел. Аркадий остановил его. — Папаша, — сказал он, — позволь познакомить тебя с моим добрым приятелем, Базаровым, о котором я тебе так часто писал. Он так любезен, что согласился погостить у нас. Николай Петрович быстро обернулся и, подойдя к человеку высокого роста в длинном балахоне с кистями, только что вылезшему из тарантаса, крепко стиснул его обнаженную красную руку, которую тот не сразу ему подал. — Душевно рад, — начал он, — и благодарен за доброе намерение посетить нас; надеюсь... позвольте узнать ваше имя и отчество? — Евгений Васильев, — отвечал Базаров ленивым, но мужественным голосом и, отвернув воротник балахона, показал Николаю Петровичу все свое лицо. Длинное и худое, с широким лбом, кверху плоским, книзу заостренным носом, большими зеленоватыми глазами и висячими бакенбардами песочного цвету, оно оживлялось спокойной улыбкой и выражало самоуверенность и ум.	Аркадий Кирсанов, сын Николая Петровича Кирсанова	https://ilibrary.ru/text/96/p.2/index.html